<?xml version="1.0" encoding="UTF-8"?>
<!--Sample XML file generated by XMLSpy v2014 (x64) (http://www.altova.com)-->
<younicos:powerProfile xmlns:younicos="http://www.younicos.com/namespace" xmlns:xsi="http://www.w3.org/2001/XMLSchema-instance" xsi:schemaLocation="http://www.younicos.com/namespace Profile.xsd">
	<younicos:start>2014-02-25T00:00:00Z</younicos:start>
	<younicos:end>2014-02-26T00:00:00Z</younicos:end>
	<younicos:powerSequence>
		<younicos:power>
			<younicos:power_kW>1000</younicos:power_kW>
			<younicos:timestamp>2014-02-25T00:00:00Z</younicos:timestamp>
		</younicos:power>
		<younicos:power>
			<younicos:power_kW>0</younicos:power_kW>
			<younicos:timestamp>2014-02-25T02:00:00Z</younicos:timestamp>
		</younicos:power>
		<younicos:power>
			<younicos:power_kW>2000</younicos:power_kW>
			<younicos:timestamp>2014-02-25T01:00:00Z</younicos:timestamp>
		</younicos:power>
		<younicos:power>
			<younicos:power_kW>-2000</younicos:power_kW>
			<younicos:timestamp>2014-02-25T03:00:00Z</younicos:timestamp>
		</younicos:power>
		<younicos:power>
			<younicos:power_kW>-4000</younicos:power_kW>
			<younicos:timestamp>2014-02-25T04:00:00Z</younicos:timestamp>
		</younicos:power>
		<younicos:power>
			<younicos:power_kW>-6000</younicos:power_kW>
			<younicos:timestamp>2014-02-25T05:00:00Z</younicos:timestamp>
		</younicos:power>
		<younicos:power>
			<younicos:power_kW>0</younicos:power_kW>
			<younicos:timestamp>2014-02-25T06:00:00Z</younicos:timestamp>
		</younicos:power>
		<younicos:power>
			<younicos:power_kW>500</younicos:power_kW>
			<younicos:timestamp>2014-02-25T12:00:00Z</younicos:timestamp>
		</younicos:power>
		<younicos:power>
			<younicos:power_kW>0</younicos:power_kW>
			<younicos:timestamp>2014-02-25T18:00:00Z</younicos:timestamp>
		</younicos:power>
	</younicos:powerSequence>
</younicos:powerProfile>
